{
  "schemaVersion": 1,
  "scenarioId": "memory-journey-first-run",
  "commit": "c10ccbd34d11863697714f44bfae53f5ae675c84",
  "environment": {
    "browser": "Chrome 150.0.7871.187 on Windows 10",
    "viewport": "1280x720",
    "reducedMotion": false
  },
  "limits": {
    "wallClockMinutes": 8,
    "inputActions": 40,
    "sameBlockerRetries": 3,
    "frictionSeconds": 30
  },
  "outcome": {
    "completed": false,
    "firstObjectiveSeconds": 0,
    "frictionCount": 1,
    "misactionCount": 3,
    "backtrackCount": 0,
    "replayDiscovered": false
  },
  "actions": [
    {
      "elapsedSeconds": 0,
      "visibleState": "A centered introduction says 'Carry one memory home', lists WASD/arrows, Space, E or click, and Shift, and offers 'Enter the world'. Journey step 1/3 already says to meet the Listener Guide.",
      "interpretation": "The primary button should enter the visible world; the first objective is already identifiable.",
      "input": "Clicked 'Enter the world'.",
      "result": "The modal closed and revealed the avatar, a pulsing trail, a nearby marked Listener Guide, and a demo-start control."
    },
    {
      "elapsedSeconds": 7,
      "visibleState": "The world is visible but the music panel says IDLE and prominently offers 'Start the Crywolf demo'.",
      "interpretation": "The built-in demo must be loaded before the musical journey can begin.",
      "input": "Clicked 'Start the Crywolf demo'.",
      "result": "The panel loaded ATHETOSIS — Crywolf.ogg in READY state and showed a Play button."
    },
    {
      "elapsedSeconds": 14,
      "visibleState": "The demo is READY at 0 / 278s; the Guide marker and direct pulsing trail remain visible straight ahead.",
      "interpretation": "Play starts the synchronized journey, then following the trail should reach the first objective.",
      "input": "Clicked Play, then held W for 2.5 seconds.",
      "result": "Playback began and the avatar moved into the Guide's interaction ring; the marker read 'Speak with the Guide'."
    },
    {
      "elapsedSeconds": 29,
      "visibleState": "The avatar is in the blue interaction ring directly in front of the marked Guide. The marker reads 'Speak with the Guide'.",
      "interpretation": "The introduction explicitly taught E as Interact, so E should complete this objective.",
      "input": "Pressed E.",
      "result": "A ambient message remained visible and Journey step 1/3 did not change."
    },
    {
      "elapsedSeconds": 51,
      "visibleState": "The avatar remains in the interaction ring and the Guide still says 'Speak with the Guide'. Journey step 1/3 remains unchanged.",
      "interpretation": "The first key press may have been missed, so a second ordinary E press is warranted.",
      "input": "Pressed E again.",
      "result": "Only the ambient message changed over time; the objective still did not advance."
    },
    {
      "elapsedSeconds": 74,
      "visibleState": "The Guide remains centered, in range, and marked 'Speak with the Guide'; the journey still shows step 1/3.",
      "interpretation": "The taught alternative is clicking, so directly clicking the visible Guide is the final retry.",
      "input": "Clicked the Guide.",
      "result": "Journey step 1/3 remained unchanged. The run stopped after the third repetition of the same blocker."
    }
  ],
  "findings": [
    {
      "kind": "observation",
      "severity": "blocked",
      "statement": "The first journey objective did not advance while the avatar was visibly inside the Guide's interaction ring after two E presses and one direct click.",
      "evidence": [
        "output/playwright/first-user-hardware/rerun/guide-approach.png",
        "output/playwright/first-user-hardware/rerun/guide-blocker-2.png",
        "output/playwright/first-user-hardware/rerun/guide-blocker-3.png"
      ]
    },
    {
      "kind": "inference",
      "severity": "blocked",
      "statement": "A first-time listener cannot continue independently because both interaction methods taught by the introduction fail to produce perceptible objective progress at the marked target.",
      "evidence": [
        "output/playwright/first-user-hardware/rerun/entry.png",
        "output/playwright/first-user-hardware/rerun/guide-blocker-3.png"
      ]
    },
    {
      "kind": "recommendation",
      "severity": "blocked",
      "statement": "Make Guide interaction reliably advance step 1 when the avatar is inside the visible ring, and provide immediate feedback that distinguishes accepted interaction from ambient narration.",
      "evidence": [
        "output/playwright/first-user-hardware/rerun/guide-approach.png",
        "output/playwright/first-user-hardware/rerun/guide-blocker-3.png"
      ]
    },
    {
      "kind": "observation",
      "severity": "moderate",
      "statement": "The ambient message overlays the Guide marker and changes while interaction attempts leave the objective unchanged, making system response ambiguous.",
      "evidence": [
        "output/playwright/first-user-hardware/rerun/guide-approach.png",
        "output/playwright/first-user-hardware/rerun/guide-blocker-2.png"
      ]
    }
  ],
  "evidence": [
    "output/playwright/first-user-hardware/rerun/entry.png",
    "output/playwright/first-user-hardware/rerun/after-enter.png",
    "output/playwright/first-user-hardware/rerun/demo-started.png",
    "output/playwright/first-user-hardware/rerun/guide-approach.png",
    "output/playwright/first-user-hardware/rerun/objective-2.png",
    "output/playwright/first-user-hardware/rerun/guide-blocker-2.png",
    "output/playwright/first-user-hardware/rerun/guide-blocker-3.png"
  ]
}
