{
  "schemaVersion": 1,
  "scenarioId": "memory-journey-first-run",
  "commit": "c10ccbd",
  "environment": {
    "browser": "Chrome/150.0.7871.187 on Windows 10",
    "viewport": "1280x720",
    "reducedMotion": false
  },
  "limits": {
    "wallClockMinutes": 8,
    "inputActions": 40,
    "sameBlockerRetries": 3,
    "frictionSeconds": 30
  },
  "outcome": {
    "completed": false,
    "firstObjectiveSeconds": 0,
    "frictionCount": 2,
    "misactionCount": 2,
    "backtrackCount": 1,
    "replayDiscovered": true
  },
  "actions": [
    {
      "elapsedSeconds": 0,
      "visibleState": "A centered Memory Journey introduction names the three-part journey, lists WASD/arrows, E/click, Space, and Shift, and offers Enter the world. Step 1 already says Meet the Listener Guide.",
      "interpretation": "The blue Enter the world button is the intended first action and the Guide is the first objective.",
      "input": "Clicked Enter the world.",
      "result": "The modal closed and the world, Guide marker, pulsing trail, demo button, and controls became visible."
    },
    {
      "elapsedSeconds": 8,
      "visibleState": "The left panel says Choose a song to begin and presents Start the Crywolf demo prominently.",
      "interpretation": "The built-in demo is the approved way to begin without choosing a file.",
      "input": "Clicked Start the Crywolf demo.",
      "result": "ATHETOSIS — Crywolf.ogg loaded in Ready state and exposed a Play button."
    },
    {
      "elapsedSeconds": 17,
      "visibleState": "The loaded track is Ready at 0 / 278s and the Guide remains visibly marked ahead.",
      "interpretation": "Music must be playing for the journey to respond.",
      "input": "Clicked Play.",
      "result": "Status changed to Playing, lighting changed, captions appeared, and time advanced."
    },
    {
      "elapsedSeconds": 25,
      "visibleState": "The player appears aligned with a bright trail and the Listener Guide marker directly ahead; the objective says Speak with the Guide.",
      "interpretation": "The listed E interaction should speak with the nearby Guide.",
      "input": "Pressed E.",
      "result": "The objective and visible world state did not advance."
    },
    {
      "elapsedSeconds": 33,
      "visibleState": "The Guide marker is still prominent and step 1 is unchanged.",
      "interpretation": "Clicking the visible destination may be the alternative interaction listed by the introduction.",
      "input": "Clicked the visible Guide/world-marker area.",
      "result": "A yellow Not Yet message said the Archive is sealed and to speak with the Listener Guide first; step 1 remained unchanged."
    },
    {
      "elapsedSeconds": 59,
      "visibleState": "The trail still connects the player area to the Guide and no explicit in-range interaction prompt appears.",
      "interpretation": "The Guide may require a closer interaction range.",
      "input": "Held W, then pressed E.",
      "result": "There was no visible objective transition; step 1 remained Meet the Listener Guide."
    },
    {
      "elapsedSeconds": 95,
      "visibleState": "The Guide, trail, and step-1 card remain visible; the music continues normally.",
      "interpretation": "World focus may be required because the Play control previously held visible focus.",
      "input": "Clicked open ground, held W, and retried interaction/clicking around the marked Guide.",
      "result": "The journey did not advance. One click opened the Echo Terminal help overlay, whose Current Objective still said Speak with the Listener Guide."
    },
    {
      "elapsedSeconds": 169,
      "visibleState": "The Echo Terminal repeats the same objective and lists E or click an object, but supplies no range or recovery cue.",
      "interpretation": "The same blocker has repeated three times, so independent completion is no longer credible within the run contract.",
      "input": "Closed the overlay and used the visible timeline to inspect the natural ending.",
      "result": "At 278 / 278s the caption said Only the afterglow remains, while Journey step 1 / 3 still said Meet the Listener Guide."
    },
    {
      "elapsedSeconds": 278,
      "visibleState": "At natural ending the transport showed Play at 278 / 278s and no distinct Replay label.",
      "interpretation": "Play is the only visible restart affordance and should replay from the beginning.",
      "input": "Clicked Play.",
      "result": "The transport returned to Playing at 2 / 278s and the opening world state/caption reappeared; step 1 was reset/preserved as the first objective."
    }
  ],
  "findings": [
    {
      "kind": "observation",
      "severity": "blocked",
      "statement": "The first journey objective did not advance after three ordinary attempts using the displayed controls and visible Guide route; the run could not proceed beyond step 1.",
      "evidence": [
        "output/playwright/first-user-hardware/candidate/05-guide-interaction.png",
        "output/playwright/first-user-hardware/candidate/06-guide-click.png",
        "output/playwright/first-user-hardware/candidate/12-after-help-e.png"
      ]
    },
    {
      "kind": "observation",
      "severity": "severe",
      "statement": "Clicking the visually marked objective area produced contradictory destinations: an Archive-sealed warning and later the Echo Terminal, while both told the listener to speak with the Guide and offered no recovery cue.",
      "evidence": [
        "output/playwright/first-user-hardware/candidate/06-guide-click.png",
        "output/playwright/first-user-hardware/candidate/11-guide-marker-click.png"
      ]
    },
    {
      "kind": "observation",
      "severity": "severe",
      "statement": "Natural ending left the incomplete step-1 objective active and did not explain whether the journey could still be completed after the music stopped.",
      "evidence": [
        "output/playwright/first-user-hardware/candidate/13-near-end.png"
      ]
    },
    {
      "kind": "inference",
      "severity": "moderate",
      "statement": "The entry/Guide presentation is visibly clearer than an unprompted world entry because it names controls, gives one primary Enter action, and immediately marks the Guide, but the operational Guide blocker is not resolved because the displayed interaction path still fails to advance the first objective.",
      "evidence": [
        "output/playwright/first-user-hardware/candidate/01-entry.png",
        "output/playwright/first-user-hardware/candidate/02-after-enter.png",
        "output/playwright/first-user-hardware/candidate/12-after-help-e.png"
      ]
    },
    {
      "kind": "recommendation",
      "severity": "blocked",
      "statement": "Make the Guide interaction succeed from the clearly presented starting route and provide an unmistakable in-range prompt plus visible acknowledgement that advances step 1; ensure clicks on the Guide marker cannot resolve to the Archive or help overlay.",
      "evidence": [
        "output/playwright/first-user-hardware/candidate/02-after-enter.png",
        "output/playwright/first-user-hardware/candidate/06-guide-click.png",
        "output/playwright/first-user-hardware/candidate/11-guide-marker-click.png"
      ]
    },
    {
      "kind": "observation",
      "severity": "minor",
      "statement": "Replay is discoverable only through the generic Play label at the ended position; using it visibly restarts playback from the opening state.",
      "evidence": [
        "output/playwright/first-user-hardware/candidate/13-near-end.png",
        "output/playwright/first-user-hardware/candidate/14-replay-attempt.png"
      ]
    }
  ],
  "evidence": [
    "output/playwright/first-user-hardware/candidate/01-entry.png",
    "output/playwright/first-user-hardware/candidate/02-after-enter.png",
    "output/playwright/first-user-hardware/candidate/03-demo-started.png",
    "output/playwright/first-user-hardware/candidate/04-playing.png",
    "output/playwright/first-user-hardware/candidate/05-guide-interaction.png",
    "output/playwright/first-user-hardware/candidate/06-guide-click.png",
    "output/playwright/first-user-hardware/candidate/07-move-forward.png",
    "output/playwright/first-user-hardware/candidate/08-guide-retry.png",
    "output/playwright/first-user-hardware/candidate/09-focused-move.png",
    "output/playwright/first-user-hardware/candidate/10-guide-click-corrected.png",
    "output/playwright/first-user-hardware/candidate/11-guide-marker-click.png",
    "output/playwright/first-user-hardware/candidate/12-after-help-e.png",
    "output/playwright/first-user-hardware/candidate/13-near-end.png",
    "output/playwright/first-user-hardware/candidate/14-replay-attempt.png"
  ]
}
