{
  "schemaVersion": 1,
  "scenarioId": "memory-journey-first-run",
  "commit": "c10ccbd34d11863697714f44bfae53f5ae675c84",
  "environment": {
    "browser": "Chrome/150.0.7871.187 on Windows 10",
    "viewport": "1584x792",
    "reducedMotion": false
  },
  "limits": {
    "wallClockMinutes": 8,
    "inputActions": 40,
    "sameBlockerRetries": 3,
    "frictionSeconds": 30,
    "stopReason": "The visible entry action remained unchanged after three repeated pointer retries; the run stopped without attempting hidden-state inspection."
  },
  "outcome": {
    "completed": false,
    "firstObjectiveSeconds": 0,
    "frictionCount": 1,
    "misactionCount": 4,
    "backtrackCount": 0,
    "replayDiscovered": false
  },
  "actions": [
    {
      "elapsedSeconds": 0,
      "visibleState": "A centered Memory Journey introduction says 'Carry one memory home,' lists movement, interaction, jump, and run controls, and offers a blue 'Enter the world' button. Behind the dim overlay I can already read Journey step 1 / 3: Meet the Listener Guide, plus a separate 'Start the Crywolf demo' control.",
      "interpretation": "I understand the overall journey and controls. The blue button is the strongest action, so I expect it to dismiss the introduction before I start the built-in demo.",
      "input": "Captured the entry screenshot and chose the visible blue entry action.",
      "result": "The entry state was recorded; the first objective was textually identifiable immediately."
    },
    {
      "elapsedSeconds": 9,
      "visibleState": "The blue entry button remains centered and visually enabled.",
      "interpretation": "A normal click at the visual center should enter the world.",
      "input": "Clicked the apparent center of 'Enter the world' at 800,542.",
      "result": "The next screenshot was visually unchanged; the overlay remained."
    },
    {
      "elapsedSeconds": 32,
      "visibleState": "The overlay and enabled-looking blue button remain unchanged. The captured page image is 1584x792 although the scenario specifies 1280x720.",
      "interpretation": "The coordinate space may differ from the visible capture, so I try a scaled point still expected to be within the button.",
      "input": "Clicked at 640,493.",
      "result": "The next screenshot was visually unchanged; the overlay remained."
    },
    {
      "elapsedSeconds": 55,
      "visibleState": "The same entry overlay remains with no visible error, pressed state, focus indication, or progress.",
      "interpretation": "A browser-window vertical offset may explain the missed activation, so I retry lower on the visible primary action path.",
      "input": "Clicked at 800,630.",
      "result": "The next screenshot was visually unchanged; the overlay remained."
    },
    {
      "elapsedSeconds": 78,
      "visibleState": "The same entry overlay remains; no user-visible feedback explains why activation has not occurred.",
      "interpretation": "I make one final screen-offset attempt, then stop rather than inspect hidden state or continue repeating the same blocker.",
      "input": "Clicked at 968,686.",
      "result": "The next screenshot was visually unchanged. I could not reach the built-in Crywolf demo, journey completion, or replay."
    }
  ],
  "findings": [
    {
      "kind": "observation",
      "severity": "blocked",
      "statement": "The run could not pass the visible 'Enter the world' gate: across repeated ordinary pointer attempts, every resulting screenshot retained the same overlay and provided no visible activation or error feedback.",
      "evidence": [
        "output/playwright/first-user-hardware/baseline/00-entry.png",
        "output/playwright/first-user-hardware/baseline/01-entered.png",
        "output/playwright/first-user-hardware/baseline/02-entered-pointer-scaled.png",
        "output/playwright/first-user-hardware/baseline/03-entered-pointer-offset.png",
        "output/playwright/first-user-hardware/baseline/05-entered-screen-offset.png"
      ]
    },
    {
      "kind": "inference",
      "severity": "blocked",
      "statement": "Because the hardware capture dimensions did not match the scenario viewport and the allowed controller exposed no usable Tab/Enter path, this result cannot distinguish a product hit-target failure from a browser-control coordinate mismatch; it is a blocked baseline, not evidence that the application itself is definitively unclickable.",
      "evidence": [
        "output/playwright/first-user-hardware/baseline/00-entry.png",
        "output/playwright/first-user-hardware/baseline/05-entered-screen-offset.png"
      ]
    },
    {
      "kind": "observation",
      "severity": "moderate",
      "statement": "Before entry, the dimmed background simultaneously exposes the first journey objective and the separate Crywolf demo launcher while the introduction presents its own primary action, creating three layers of next-step information at once.",
      "evidence": [
        "output/playwright/first-user-hardware/baseline/00-entry.png"
      ]
    },
    {
      "kind": "recommendation",
      "severity": "blocked",
      "statement": "Re-establish and verify the required 1280x720 visible coordinate mapping and an ordinary keyboard activation path, then rerun from a fresh profile before using this baseline for product comparison.",
      "evidence": [
        "output/playwright/first-user-hardware/baseline/00-entry.png",
        "output/playwright/first-user-hardware/baseline/05-entered-screen-offset.png"
      ]
    }
  ],
  "evidence": [
    "output/playwright/first-user-hardware/baseline/00-entry.png",
    "output/playwright/first-user-hardware/baseline/01-entered.png",
    "output/playwright/first-user-hardware/baseline/02-entered-pointer-scaled.png",
    "output/playwright/first-user-hardware/baseline/03-entered-pointer-offset.png",
    "output/playwright/first-user-hardware/baseline/05-entered-screen-offset.png"
  ]
}
